review,sentiment
"This film really disappointed me. The acting is atrocious. Unbelievable. And it's about actors. The story is incredibly obvious: A group of independent actors stage a Passion Play and, in turn, they start to live out the lives of the characters they play. I've been watching a lot of movies lately, thanks to Netflix, and this is the first one I haven't watched all the way through in a long time. I felt I didn't need to see the end; we all know the end of this story.<br /><br />For some, it seems, this ""modernization"" of the Gospels is either sacrilegious or enlightening. I cannot speak to any of this as I wasn't raised in the Christian church. That being said, I was raised in the US and I live in an increasingly Christian culture. I'm curious enough about Jesus and about the modernization of the religion, for better or worse. I haven't seen Mel Gibson's version, but I'm guessing that those who liked that one will like this, except for the most conservative. I just wish this was a better film.<br /><br />Lots of these reviews praise Arcand's direction and especially the cinematography. I liked neither. The film itself is rather prudish and preachy. I didn't believe the characters' personae and I was never involved with their on screen lives. The play within the play is very much dated and would not, I think, carry it's own weight in a real time production. But that's beside the point. What I really needed for this to work would have been stronger development of the characters and the plot to support the philosophical and theological questions the film would like to be about. And the musical choices are obvious and unoriginal.<br /><br />There were two examples of this that come easily to mind. Firstly, there is a reenactment of the parable of Jesus driving the money lenders from the temple: the lead actor, who has fallen for the woman who will play Magdalene and who is also a model and dancer, becomes enraged that she must debase herself by auditioning for a commercial (with a wicked producer and plenty of panting men in the audience) with her pants off. He trashes the place and chases them all out. I guess this is the level that the film wishes to reach. The romance between these two is entirely arbitrary and not at all emotionally realized and the scene is played out like a high-school rendering of Death of a Salesman, i.e., not well. Please stop hitting me over the head with this high-handed ""significance."" The other is the relationship between the other female lead and the priest who has asked them to do the play and who, eventually, turns against them and betrays them to the nowadays-corrupt Church. Why. Why does she sleep with this guy. ""It brings him so much pleasure and me so little pain."" Ah, the saintly whore and the lovable old coot. It seems to be just enough for Arcand to signify but not worth the trouble to enrich and enliven these characters. They are going through the motions and I'm reaching for the eject button.<br /><br />Feel free to write me off as bored, jaded or just not interested. Feel free to watch this movie and see the Passion, in all its beauty, sadness and inspiration, delivered as an amateurish and gimmicky charade. Feel free to have all your preconceived ideas affirmed and see any shred of artistic integrity forsaken for monotonous drivel. But don't say I didn't warn you.",0
"Bela Lugosi is a real enigma. In the early 1930s, he was on top of the world after appearing in Dracula. Yet, again and again, he made lousy decisions regarding his career. Perhaps he had a bad agent, perhaps his drinking and drug use had a part in it or maybe he was just crazy. Regardless, he ruined his reputation by appearing in pretty much any film--ranging from excellent horror films (such as THE RAVEN) to big-budget flicks (like NINOTCHKA) to grade-Z flicks for the cheapest and shoddiest of studios. Interestingly enough, although he agreed to do this terrible film, he actually turned down the role that later went to Boris Karloff in FRANKENSTEIN! As for this movie, it is a very silly an horridly produced WWII propaganda film that featured a dumb plot and wretched editing. Lugosi spends much of the movie murdering saboteurs--not a bad thing at all. But at the end, we find out that he is himself a Nazi plastic surgeon and all the American-looking men he killed were actually Japanese!!!! The funniest part of this is during a flashback. You see Lugosi talking to a group of Japanese men before he changes them to American-like men. When the camera scans them, the men are clearly Asian. But, on all the other non-close-up shots, they are all VERY Western looking--many with bald heads!! They looked absolutely NOTHING like Japanese men. I suspect the plot must have undergone a re-write and this might account for the obvious mistake. Or, it could just be shoddy production values and editing. In fact, early in the film, they show a street scene in the city and all the cars (circa 1942) are old Model T Fords--obviously from stock footage!!! The bottom line is that the film is bad but also very dull. Unlike PLAN 9 FROM OUTER SPACE, it's hard to laugh at the ineptitude--just be put to sleep by it.",0
"Possibly the worst film within the genre in existence. It was announced as a comedy, but is simply tragically pathetic. I don't think anyone could have achieved anything more terrible and irritating if they were specifically requested to. It is toilet humour at its very poorest, I would avoid even watching the trailer. I only went to see it because it was announced that if you like Monty Python, you are bound to love this. Whoever wrote that was either biased or seriously deranged. I am still bewildered how one can honestly believe such a statement. Rarely do I leave the cinema, really it takes a lot of effort for a film to have that effect on me: this one did it in just 30 minutes.",0
"This is possibly the best short crime drama I've ever seen. The acting is superb especially Amanda Burton who's character goes from scary to sweet to disturbing to sad and then some...She does an amazing job balancing Rachels/Carlas feelings and acting out the pain of someone who's lost a child, its so believable that it feels more like a real life story then a drama. The other actors are of course great too which they usually are in British TV/Film. The ending,which I'm not going to give away,is fantastic mainly because you don't really get one... (you'll get what I mean after you've seen it) This is well worth buying and seeing over and over again and if you're not touched by this you're one cold hearted person.",1
"If this movie was written directed and produced with the intention of creating a bad movie cult classic, it might (i say might) have been a hit. Have you ever sat and watched a movie that was so absolutely awful that it becomes fascinating in terms of its faults? Well this is it. Every one of the acting cast should be nominated for worst acting performance awards. It would be hard to find another film, with this kind of production budget, that contains so little of any value whatsoever. The whole thing, from the opening scenes defies logic. Dialogue is completely unbelievable and illogical. Ditto for the behaviour and general storyline of the film itself. What is really mind boggling, is that some buffoons in a boardroom actually made decisions to spend money on this piece of trash. Wow.",0
"Someone should teach the people who made this movie that there is a difference between ""presenting multiple twists"" and ""screwing the audience over"". They even use hypnosis as a tool to cover up the plot holes; whenever they can't find their way into or out of a scene, they just say ""she is regressing to her past now"" or ""she's snapping out of it now"", and they think that explains everything. This movie is a dishonest cheat and in the last 20 minutes becomes a full-blown fiasco. (*1/2)",0
"Guys and Dolls is a unique play based on the characters. Sky Masterson<br /><br />(Marlon Brando) is a high-class gambler who takes up a bet with Nathan Detroit (Frank Sinatra) for one-thousand dollars. Nathan needs the money so he can<br /><br />run his usual crap game and make a fortune. The bet was that Sky wouldn't be able to take just any girl to Havana, Cuba and the ""doll"" he chose was Sarah<br /><br />Brown (Jean Simmons) who was in charge of a missionary. Sky finally bribes<br /><br />Sarah enough to go to Havana with him. They end up falling in love with each other, but later she accuses him of something he had no part in. Nathan ran a crap game in the missionary the night they were gone. Nathan's 14 year fiancé Adelaide (Vivian Blaine) disapproves of Nathan's gambling and tries to stop him from doing it. However, when the movie ends it all ends happy with a double<br /><br />wedding.<br /><br />The songs in this movie are just wonderful no matter who sings it. Marlon<br /><br />Brando has no singing voice at all and true they could have dubbed him but it didn't really matter. He did a wonderful acting job (obviously seeing as it's Brando) and played his character very well. I have seen a few movies with Jean Simmons and thought that this movie was her weakest one, she also couldn't<br /><br />sing at all. However, the singing is made up by Frank Sinatra, Vivien Blaine, and Stubby Kaye. Vivien Blaine and Stubby Kaye was also in the original<br /><br />Broadway production of Guys and Dolls. Vivien Blaine had a terrific voice and was the perfect Adelaide. If you like musical, and even if you don't, i advise you to watch this.",1
"Dad (78) and I (46) both had a good time watching the flick today. For a guy primarily known for serious roles, De Niro is a heckuva comic actor. Of course, it helps to have his past film images to play against. Consider that one of those roles, 15 MINUTES, was a cop having to deal with the interference of the mass media, and you have an interesting set of compare/contrast performances.<br /><br />Murphy plays another of his Axel Foley sort of characters. Shatner plays a burlesque of himself, a parallel world self who was best known for TJ HOOKER and not STAR TREK.<br /><br />It's interesting to watch how the film comments on the contrasts between the reality of police work and its fictional counterparts in TV and film. Shatner lectures on the proper means of sliding across a car hood; De Niro points out holsters scratch the hood finish. Ironically, as the film progresses, De Niro's character begins to incorporate the illusions of TV-cop reality into the real world case he's working.<br /><br />The film draws its inspiration from a gamut of sources, so one could make the comment it is derivative. Well, so what? Satire needs to derive its humor in order to exist. And besides, the film does have quirky moments of originality. For example, I'm reasonably sure the method of the villain's death has never been done before. <br /><br />One quibble about the reality of the weapons involved-- shouldn't those guns have had some kind of recoil? In order to penetrate steel, those bullets had to have enough inertia to penetrate. And any bullet's highest level of inertia is at the moment of firing. So.... firing a volley of these tank-killer bullets should have driven the shooters back onto their butts. Oh, what the heck... it's a satire. Maybe the guns' lack of recoil is itself a satire on the B-F-Guns used so casually in thrillers. <br /><br />",1
"Thanks Jymn Magon, for creating Disney's 2 best cartoons ever. This show has improved very much over the years. As a kid, I didn't like it because I thought it was a rip-off of Ducktales, which was my favorite Disney thing at the time (like Grandmoffromero). Then later on though it was good but not great. But after reading the reviews here, I decided to give it another chance & bought the DVD set & watched the whole pilot the first day I got it, & was very pleasantly surprised. It's still my favorite episode, although the series did live up to it. And by the end of disc 1, I knew this was going to be a top tenner.<br /><br />The characters are so complex & charming. My favorite has got to be Wildcat. He's absolutely hilarious and sweet to boot. My next favorite is Baloo, the best pilot on the show. I can see why 'ol Jymn built the show around him. Then it's Kit Cloudkicker. He & Baloo have the best relationship in the series. After that, Louie. Jim Cummings did a perfect job of impersonating the original voice. After him, Rebecca. She has made me laugh pretty hard, and I do believe she and Baloo eventually marry. And finally(for the heroes), Molly. Although she's my least favorite, I still like her. I think she's a very cute character(much better than Webby from Ducktales). And the villains were very original. Don Karnage & his air pirates always crack me up, Kahn is ice-cold and ruthless, and the Thembrians are always at least amusing.<br /><br />As said before, the stories range from hilarious(Time Waits For No Bear, Romance of Red Chimp) to nothing short of touching(The Old Man & the Seaduck, Paradise Lost), to fun, funny & exciting adventures(In Search of Ancient Blunders & my favorite For Whom the Bell Klangs). These are only a few of my favorite episodes. Anyway, Talespin is Disney's best, aside from Gummi Bears Some reasons for this? GB had a decent amount of my favorite character(Cubbi), while TS didn't have enough of Wildcat. But in the end Talespin remains a classic. BOTTOM LINE- 10/10 6th best cartoon ever.",1
"I may be a sentimentalist. But i found this movie truly moving. It was the first movie that reduced me to tears. And it did it more than once!! I recommend it to anyone both gay and str8. Religious or not! Supporting co-star Jackie Bisset stole the show, especially with her one liners. The nude scenes were superbly crafted as well, and all in were good taste. Most shocking was the portrayal of the orientation reversal deprogramming instituted by the Mormon church to the lead character. It shocked me that this still goes on in the world. Nevertheless I enjoyed this movie tremendously. This is definitely the best gay film since Torch Song Trilogy. And much better than the other gay movie offering that year - The Fluffer.",1
"The original ""les visiteurs"" was original, hilarious, interesting, balanced and near perfect. LV2 must be a candidate for ""Worst first sequel to a really good film"". In LV2 everyone keeps shouting, when a gag doesn't work first it's repeated another 5 times with some vague hope that it will eventually become funny. LV2 is a horrible parody of LV1, except of course that a parody should be inventive. If you loved LV1 just don't see this film, just see LV1 again!!",0
"Mickey Rourke is enjoying a renaissance at the moment... and fair play to him. I always liked his image and his acting ability in such fare as Angel Heart and Johnny Handsome. You know what you are going to get with Rourke - mean, moody, dirty. But this film gives you much more - and you don't want most of it.<br /><br />First and foremost - this whole thing just doesn't make sense. Rourke is a hardened IRA killer who after killing a bus-load of schoolchildren flees Ireland for London. He is on the run from the cops and from his own Army comrades. He has also vowed to never kill again. It looks like the bus full of kids finally did it for him.<br /><br />However, when he gets to London he is tracked down by a local mobster (Bates - looking like his eyebrows and hair came straight off a Burton's dummy) to kill his main competitor in turn for £50,000 and a boat trip to the US. Rourke reluctantly agrees to do it but is seen by a priest (Hoskins) and confesses the crime to him in the confessional in order to keep the priest's mouth shut. He figures it is better than killing him.<br /><br />A wealth of things arise here which just don't add up : 1. Why pick Rourke to off your competition? As is illustrated by a scene whereby an employee is pinned to a wall by a couple of heavies with what look like awls - these London guys are tough enough anyway to do their own killing. 2. Not only that but the Mobster gets a guy to follow Rourke and witness the killing with his own eyes. Why didn't that guy simply kill the competitor and save all the hassle of dealing with Rourke? 3. Hoskins sees the murder take place and the police let him go off - without protection, I may add - to take confession? No way. 4. Rourke hangs around the church (right next to where he carried out the murder ) immediately after the crime takes place to go to confession. Why aren't the cops checking the place out? 5. Rourke hangs around the church and Hoskin's blind niece in particular, for days afterwards without anybody bothering him. What? He's on the run and he stays put by the very place where he committed another murder? Stupid. 6. The cops actually meet Rourke in the church ""fixing"" the organ and have no idea who he is. Do they not know he is on the run for the school bus bombing? They don't even check up on him? 7. Why get Rourke to kill for you, and then tell him to wait around for a few days to get on the boat? You'd think you'd want to get rid of him immediately. Or kill him. One or the other? 8. Why does Bates' brother suddenly decide to rape the blind niece in the midst of all the waiting? Could he not restrain himself for a few days? At least until Rourke has been safely offed to the States? Ridiculous. 9. Rourke suddenly has inner turmoil after all his years of killing and wins over the blind niece immediately - even after she knows he is a killer, she still loves him? Again - utterly ludicrous. And besides - she falls in ""love"" with him in record time - a few days !!!! 10. The whole bomb thing at the end is just plain silly from Bates point of view. 11. Things happen in parts of this film that just do not make sense or are simply in there to help the storyline (and I say that in jest) along. Bates' houses Rourke in a whorehouse until the boat is ready to sail and Rourke suddenly displays a moral high ground to respect the whore in the house - but yet will bed a blind girl. 12. Rourke asks a henchman on the boat where Bates is - and the henchman practically spurts out the entire movements of his boss in less than 10 seconds. It was embarrassing - the guy was telling Rourke far more than he even asked. 13. Hoskin's priest is an ex-army guy and we see him beat up three henchmen behind a pub. Totally uncalled-for and yet another cringe-worthy scene.<br /><br />I'm gonna stop there at unlucky 13 without mentioning Rourke's hair (so falsely red it is laughable), his accent (which to be fair is not too bad sometimes but deteriorates to a barely heard mumble at other times), his clothes, walk, looks to the heavens etc. Nor will I mention the music and the choppy editing style.<br /><br />Oooppps - I have just mentioned them.<br /><br />Overall - a disaster of a film with some obvious religious imagery thrown in (Rourke on the cross, preaching from a pulpit) which would embarrass a first year film student never mind a top star and director.<br /><br />4/10.",0
"Ann-Margret did the best job she has ever done in her history of film making. I felt as if she WAS Mrs. Frey. There might be one or two films of Ann-Margret's I have not seen since her film debut in ""Pocket full of Miracles"" with Betty Davis in 1961. I feel she has been totally under-rated in the industry. Though she was nominated for an Emmy Award for this role in ""Who Will Love My Children,"" she was overlooked. Like she was nominated for an Academy Award for her roles in ""Carnal Knowledge"" and ""Tommy,"" she was snubbed. Over all, I think everyone did a superb acting job including all the children in ""Who Will Love My Children."" Yes, it is a sad movie (as true stories can be), but well worth the time. Thank you.",1
"this is film is probably one of the best i've seen so far. i would put it only second to All About Lily Chou-chou because it kind of gives me the same vibes....'9 souls' is about 9 prisoners who have just escaped prison to go and find some counterfeit money stored in a time capsule at Mount Fuji Primary School. they later find out that there wasn't much there and set off on their own ways. the first half of the movie is just a time for the characters to be introduced and for the main points to be stated. it is a comedic yet serious part of the journey. the second half, moved me to tears. as the movie progresses, each character goes and tries to fulfill their dreams, but unfortunately ending somewhat badly. in the end only 2 of the 9 escapees are left. the way that each character left the scene was very sad and you will probably feel tears in your eyes. a beautiful film directed fantastically. this is a movie for people who have enjoyed Toshiaki Toyoda's other films such as 'Blue Spring'.",1
"Trapped: buried alive brings us to a resort that has just opened, and is soon to close.<br /><br />We start with a guy in gear blowing up drifts, to avoid the possibility of avalanches. somehow, that doesn't make sense. anyways, he's about to blow away one particularly big one, when he notices the resort is open. despite his best efforts, higher authority tells him his day is over.<br /><br />soon, as everyone expects, an avalanche hits.<br /><br />Look, i'm not gonna reveal any more, all i can say is this was a B-movie designed for the family channel (which i just saw it on, and the fact it had no commercials proves it's a B-movie) anyways, it's a pretty decent film, but it's partially unreal.<br /><br />firsthand, when people are buried by ice and snow, they're buried. not just traced by powder. or, what about a CD for a screwdriver? it's not possible. and finally, what i can't stress enough, is that an explosion cannot stop a avalanche, guaranteed.<br /><br />furthermore, it's worth a rental or a TV viewing, but not owning. 7/10.<br /><br />The movie is rated PG, but maybe it should have received something a little more strong. a boy nearly loses his foot in an elevator, but his leg is cut around the ankle, a guy is toasted by electricity and diesel, and in the weight room, dead people are laying around.<br /><br />enjoy.",1
"I bought this movie sight unseen at a sci-fi convention and I got what I deserved for doing something so silly. Simply put this movie is implausible, boring and unwatchable.<br /><br />I was so bored and disgusted with the lack of plot development that I turned it off to watch a repeat of Mythbusters. I understand that this was a very low budget move, or least it looked like a very low budget move, but that does not excuse the horrible acting, terrible plot and even worse camera work. It looks like something a group of college students did in between classes and getting drunk.<br /><br />Maybe if the villain wasn't so laughable and the plot was something that actually could happen in real life with respect to law enforcement it might become so bad it's funny. This movie isn't funny, it's just bad.",0
"The operative rule in the making of this film seems to have been ""never make a 1 minute scene when you can make it a 10 minute scene."" This was a principle set right from the start with an interminably long portrayal of the graduation of the Harvard class of 1870. The point of that scene, I suppose, was to introduce some of the primary figures in the story and give a bit of their background - which is somewhat effective when comparing the idealism of the Harvard graduation ceremony to the realism of life in Johnson County, Wyoming, but it just keeps going and going, and that sets the stage for a film that features repeated stretches of mind-numbing nothingness, made even worse by the fact that I found a significant amount of the dialogue to be almost incoherent. In the end, I couldn't even watch this in one sitting. I got through about half of it and had to set it aside for a couple of days before I could drag myself back to see how it turned out.<br /><br />My reaction to this movie in many ways is a shame, because there are positives here. The performances are generally of a high calibre, especially from Kris Kristofersson as Averill, Christopher Walken as Champion and Isabelle Huppert as Ella. The basic story - interspersed as it is around that ever-present mind-numbing nothingness - is potentially interesting, focusing on the efforts of immigrants to establish themselves in Johnson County and a local cattle company's efforts to stop them by killing a number of them in collaboration with the government and the military. There's also some absolutely breathtaking scenery shots. Having said that, the whole thing could frankly have been done in half the time - and should have been. In the end, all those potential positives are washed out by - again - the mind-numbing nothingness that the movie seems to revolve around. Seriously - 2/10.",0
"I have this movie on a collection of inexpensive B-movies. It's not restored, in fact, the audio was difficult to discern for the first few minutes.<br /><br />At first, it seemed like a typical haunted house film, and feels very much like the forerunner of Clue, Murder by Death, House on Haunted Hill, etc.<br /><br />About a half hour into the film, the storyline takes a really interesting twist--and it goes from being a cliché melodrama to something entirely different, and far more entertaining than I had initially thought.<br /><br />Check it out, it's a great deal of fun, even if the long clips and wider shots (and near lack of music score) make it feel a bit creaky by today's standards.",1
