review,sentiment
"""9/11,"" hosted by Robert DeNiro, presents footage from outside and inside the Twin Towers in New York, on September 11, 2001.<br /><br />Never too grisly and gory, yet powerful and moving. ""9/11"" is a real treat. Anyone not moved by this television show is immune to anything.<br /><br />5/5 stars --<br /><br />",1
"The 60´s is a well balanced mini series between historical facts and a good plot. In four deliveries, we follow a north American family, with 3 members. But we don't only see them. We also follow the story of several characters as a black reverend, an extremist student leader, and a soldier in Vietnam. The filmography is just extraordinary. In the first chapters, we see some shots of the Vietnam war, in between the scenes. The next chapter, doesn't start where the last one finished, it starts some time after, giving us a little mystery on what happened. In general, The 60´s mini series, is a must see, not only for hippies fanatics, but for everyone with little curiosity about the topic.",1
"While thinking of ""The Great Escape"" I allowed my mind to wander back to this little gem of a movie from my childhood. I had read and re-read the autobiographical novel from 1949 which inspired it, and when it came to the only cinema (we never used that word then , actually) in town that showed ""foreign"" films, I was first in line to buy my ticket.<br /><br />As someone brought up on wartime newsreels and propaganda films during WWII, I had an avid interest in exploring the realities of that conflict as reflected in the memoirs and stories of men who were there in person. That extended later to a keen willingness over the years to buy any book on the subject, and eventually to read the equally compelling novels of Hans Helmut Kirst and Erich Maria Remarque, which provided an even deeper sensibility. The movie versions, however, were unlike this one in that they rarely delivered the goods.<br /><br />The medium of black-and-white film has never been served so well as it was in those years. I have never seen any technicolor version of war that seems as authentic as do the deep chiaroscuros of films like ""The Wooden Horse."" If it is true that we are destined always to be captive to the images of our childhood, then I confess it freely.<br /><br />And there will never be another the likes of Leo Genn as the emblematic British war hero on film. Not even Sir Alec.",1
"When I started watching ""Fay Grim"", I had no idea that it was a sequel to ""Henry Fool"". Now, the latter was not a movie that I envisioned as having a sequel. But one has arrived, and it's quite good. I assume that you've seen the original, so I won't explain it. This one starts with Fay (Parker Posey) living with her son whom she had with deadbeat Henry (Thomas Jay Ryan). Simon (James Urbaniak) is still in jail. One day, the son gets expelled for bringing a pornographic toy to school. But this is no ordinary toy. It holds a secret that explains much of what happened in the first movie. And this secret delves deeper into geopolitics than ""Syriana"".<br /><br />I must say that I'm quite impressed with what Hal Hartley has accomplished here. Maybe this one doesn't quite reach the original's quality, but it certainly takes a good look at what's going on in the world. And the end leaves open the possibility for another sequel.<br /><br />Also starring Jeff Goldblum.",1
"While I was watching this movie I never thought I'd be defending it. It's honest enough from the begininning about not having much of a plot. There's no real characters to latch onto except the killer. Some of the acting can be better, but most of it is capable.<br /><br />I know, a three out of ten isn't stellar, but there are reviews saying it was shot poorly and completely useless, etc. I think it set out to do what it's supposed to fairly well. The lighting is minimal at times, more natural than most audiences are used to, but it's supposed top look like a camcorder snuff film. In fact, at times the quality is probably still too high to be true to that, but nobody would make it through tne minutes of camera work that's truly that bad.<br /><br />It's not particularly scary, but it is disturbing at times. There are one or two characters who don't come across as believable at all and the soundtrack does get tiring at times, but overall it was put together cleaner than a lot of camcorder movies.",0
"From what I've read a lot of people were disappointed by this film, compared to Part 1. Initially I could understand this but after a bit of thought I think they are wrong to be. Soderbergh continues his fact based telling of Che's life that he started in Part 1. Part 1 told a story of a revolution moving from unpromising beginnings to an ultimately successful conclusion. Part 2 tells a story of a revolution that moves from unpromising beginnings to a completely unsuccessful conclusion. It is not Soderbergh's fault that these 2 parts of Che's life had completely different outcomes. He bravely chooses to tell both in a fairly straightforward way. The viewer may feel a lot better coming out of the cinema after Part 1 than Part 2 but that is the reality of Che's life and not in my opinion any fault of the director. The film is far from perfect. It is probably too long. At least in Part 1 we saw different aspects of the war as the guerrillas had successes. In Part 2 they can't catch a break and we see their numbers constantly being reduced by death and capture. Che's capture and death are dealt with well. The film is greatly enhanced by the dialogue being in Spanish. Benicio Del Toro is again excellent as the charismatic Argentinian. So if you've seen Part 1 you will see a very similar telling of a very different story in Part 2.",1
"This movie is... horrible and wonderful at the same time. I first saw it when I was about 13 or 14 years old, so it has a great deal of nostalgic value for me. In this movie, Cesar Romero actually plays the character of Octavio, the man who ""discovered"" Santana. There are also two other actors, Monte Markham (plays Sam, who is trying to save his daughter) and Peter Mark Richman (plays the priest), who have large filmographies, and these are the only performances that are okay. The rest of the acting and the movie itself have all of the B-film qualities that some of us cherish.<br /><br />I recently spent 2 years trying to acquire a copy of this movie, and it is almost nonexistent. I am assuming that it was discontinued very shortly after its release. But I did eventually find a copy and paid a pretty penny to acquire it. If you happen to come upon Judgement Day in a video store (unmistakeable with a cheesy green ""satan"" on the cover), count yourself among the blessed who live near one of the few video stores that still has a working copy. A must see for those of you who like to laugh at cheesy attempts at a scary movie.",0
"This film is a brilliant retelling of Shakespeare's classic love story, complete with ""kinky sex, body piercing, and dismemberment"". It does follow the same spirit as all the other Troma movies [except Combat Shock...That sucker was depressing] but it's not only for Troma fans. Anybody who appreciates lowbrow visuals and a hilarious script will without a doubt fall in love with this movie.<br /><br />Don't expect pretentious, artistic-wannabe crap like the version of R&J with Claire Danes and Leo DiCaprio; this one knows its a silly movie and draws its humor from that. The acting is also surprisingly good, and you can just feel Sammy Capulet's pain as he tries to put his brain back into his head.<br /><br />The soundtrack, which contains many original and high-energy bands like The Wesley Willis Fiasco, Supernova, and The Meatmen is also four-star. This movie should be viewed by all, because it remains faithful to the original story while still being jam-packed with Troma's trademark gore/sex humor.",1
"In terms of the arts, the 1970s were a very turbulent era. In literature and the visual arts, it was the closing of a great fifty or sixty year period of creativity that has yet to be restarted. In music it was a decade that many see as a low point, due to corporate rock and disco. On television it was a Golden Age for situation comedies, from The Odd Couple to the Mary Tyler Moore Show to M*A*S*H to All In The Family, but in film it was even a greater period of creativity, in all genres, that saw the rise of the American auteur- directors like Robert Altman, Francis Ford Coppola, and Martin Scorsese- from the ashes of the old studio systems that had dominated Hollywood for over half a century. These directors wanted to craft literate, arts films for the masses, of the sort that had been staples in Europe since the end of the Second World War. Yet, the studios were trying to keep pace, with socially aware films of the sort not seen since the 1930s.<br /><br />But, unlike the films of the 1930s, starring actors like Jimmy Cagney and John Garfield (usually co-starring the Dead End Kids), that dealt with social issues in a gritty realistic way, or as realistic as one could get on a sound stage, the social consciousness of the late 1960s and early 1970s manifested itself most in science fiction films, which allowed the Left Wing of Hollywood to preach to the masses under the guise of what most considered little above comic strip entertainment. There was precedent for this approach, for several of the flying saucer films of the 1950s dealt with the political zeitgeist of the McCarthy era- most notably The Day The Earth Stood Still and Invasion Of The Body Snatchers. And the early 1960s saw Rod Serling constantly subverting the political conservatism of the time by casting social issues into science fiction settings on his classic sci fi television anthology show The Twilight Zone. Among the studio offerings of this time were the ecologically sensitive Silent Running; George Lucas's first film THX 1138, which dealt with consumerism, group think, and existentialism; and Logan's Run, which hammered away at Communism and state control versus the rights of an individual. Some of the film's references are quite heavyhanded- and reek of the then current Arab oil crisis and rampant inflation. A few jarred strawberries cost $150, and Soylent rations its assorted colored foods- Soylent Yellow, Soylent Red, and the new Soylent Green, reputedly made from 'the finest undersea growth,' in a manner not unlike the gas rationing of the time. Scenes of food riots are eerie echoes of the oil riots at many gas stations during the year of the film's release, and the scenes of crowding, and bodies, live and dead, lying all about are still chilling, as well as influential. A later film like Escape From New York is an obvious progeny. The rest of the script, by Stanley R. Greenberg, however, is rather pedestrian, and fairly standard for a dystopian flick, but Fleischer and cinematographer Richard H. Kline do a great job of filling the screen with interesting images and sounds, to spice things up. The use of soft, dimly lit visuals, murkily filtered, add a Stygian feel to the New York of the film, almost like a colorized version of Carl Theodor Dreyer's Vampyr. The only light in the film comes from artificial sources, and were it not for the fashion faux pas the film could truly seem timeless.<br /><br />The end of the film, where Thorn sneaks into the processing plant where human corpses are made into Soylent Green wafers, is both chilling, and oddly drama-less. In the end, the Soylent minions hunt Thorn down, but he survives long enough to utter the film's catchphrase to Chief Hatcher. Yet, one does not know if it is enough, for Hatcher has already been co-opted, and has a track record of taking the easy way out. Yet, that fact, and its ambiguity, shows that the film does not recapitulate its characters' dilemmas, and has a depth many later, better made films, sci fi or not, do not have. It is also why Soylent Green is still a film worth watching.",1
"I have to say that there is one redeeming speck in regards to this ""film"". It firmly establishes the bottom of the barrel. Now filmmakers know what to aim above when making a movie. Other than that I regret watching this debacle. What shameless abandon the making of this ""film"" was. What a waste of $100,000 (that's right folks, ONE HUNDRED THOUSAND dollars). This ""film"" reminds me of that ""Adult Video Awards"" show in which of group of ""industrial prostitutes"" stand up a praise themselves, believing that they are real actors, actresses and filmmakers. Ironic then how I've watched blue movies with better acting, directing and writing. I also found it funny that the Executive Producer, Justin Ament, just had to be in the ""movie"". He plays Deputy Jake Barker. I'm sure his ""acting"" career has taken off... Ted Pfiffer, the writer, has a part. He no doubt was wallowing in the clichéd glory he created. It should be noted that Carrie Finklea has a lead role in the movie. You might remember her from Gus Van Sant's 'Elephant'. Though I'm not too sure that she'll want to write this film on her resume. And I'm not sure which is a more depressing point; money was spent to make this film or people are going to watch it. Along with 'Torque', 'Godsend' and 'Sky Captain and the World of Tomorrow', one of the worst films, IF NOT THE WORST FILM, of 2004.",0
"A surprisingly complex and well crafted study of ""The First"" serial killer in the USSR. Set in the days of perestroika this intense piece is brought to full life with the performances of Stephen Reah and Donald Sutherland.<br /><br />This examination of Cicatillo as a killer is well rounded and by hinting at some of his behaviors while out right showing others there is a subtlety that is compelling without being overtly graphic. Not for the weak of heart however as it's subject matter is often disturbing but necessary to it's full development of the main participants in this fact based story.<br /><br />HBO has furnished us with an excellent film in an unusual manner. Congrats to the director and editor of this great piece. It is in my Top 10 Must see list.",1
"Recap: A band of five young American men, all that is left of a platoon hit hard during the Ardenne offensive during the WWII get the assignment as a forward outpost and to look for enemy activity. They're in really bad condition, both physically and mentally, and think they have struck gold when their outpost is in an abandoned but once plush mansion full with food. But after a while there is some enemy activity, and it is very odd. Not hostile, but odd. It seems like there is a German squad out there, in equally bad condition, that want nothing more than to surrender.<br /><br />Comments: Based on a novel and my guess that the novel is much better but the story doesn't seem to translate very well to the big screen. Indeed it is a different war movie, much more about the mental pressure during wartimes than fighting and battles. But I can almost feel that scenes that must have been full of suspense, full of uncertainties and unknown elements, just fall flat in the movie. It is not suspenseful, just different and in many ways absurd. Many times people just act insane, and the reasons are unclear or at best hinted at.<br /><br />So when this mental pressure fails to come through, the main building piece of the entire story, I thought the story fell through. It wasn't good, it wasn't interesting, it didn't keep me on the edge and it didn't really send a message. Actually it did nothing.<br /><br />The cast is interesting, many young actors that then turned into stars in beginning of their careers. The acting is good, but not stellar, and a few characters also fell through into the absurd zone. Much of that too I feel is due to that this story, these characters need the time, space and pace given in a novel, that they can't be given here. And going halfway definitely isn't good enough.<br /><br />4/10",0
"or: It's a bird ? It's a plane ? No, look... It's a disaster ! or: No need to look up in the sky.<br /><br />or: (... OK, that's enough.) If singer tried to make a romantic titanic like movie to crash the box office record, he failed. The SR structure can't do this, the dark and restricted color scheme (I would call it ""wishi-washi""), the boring usual dialogs, the clown with advanced alien technology, the missing fun and magic, etc. makes the movie completely disappointing.<br /><br />It simply doesn't work.<br /><br />The main thing at a character like superman is, that he is a superhero. That's the core, the most important thing.<br /><br />Love trouble and a sadly lost depressive Supersoftie can maximal only be a facet in a 2:40 long Superman movie, not the whole time.<br /><br />Because then it is not a superman or superhero movie anymore. It's like a (and in this case a very bad and boring) social study, where every 30 minutes a person flies around.<br /><br />That's a big difference.<br /><br />This movie is a joke. Holy skywalker, this is Superman, so give us Supervillains, Superaction and the most important thing, Superfun.<br /><br />We want ENTERTAINMENT ! Singer, if you want to make a 2:40 long soul love trouble drama about lost and sadly people ? Then take normal human characters and make a yentl remake.<br /><br />They say: Superman returns. And then, supersadlysoftie stands in the door.<br /><br />Maybe singer has tried to kill the legend without kryptonite, but one bad movie can't do this. Don't give up, they plan a sequel...<br /><br />Next time singer (and Warner Brothers), make a superhero movie, not a depressive superlame soap, or let it be. A superhero movie means a colorful fantasy with a lot of fun and magic.<br /><br />This movie is like a very cheap chocolate box with a super cover. Yes, technically there are all sorts in, yes, there is a lot of small talks, there are a few jokes, a view action scenes, etc, but the only one what all these worse pieces have in common is their poor quality.<br /><br />It's not more than a super boring patchwork and one of the worst movies I have ever seen in my live.<br /><br />The ridiculous cast strategy (Cast them young as possible, so we can make sequels in the next 25 years) gives the rest. Kate Bosworth plays a 22 year old star reporter, she's looking like 19. Superman was full five years away, so he slept with her 6 years ago, so she was 16, (looking like 13) and a daily planet reporter, wroting ""I spend a night with superman"". Warner Brothers, that's too much.<br /><br />Routh is not so bad, he is playing a little bit wooden, but the whole movie is wooden, so... ?! Temporary good were marsden and sometimes posey. The rest, forget it. Even spacey, this is not his terrain.<br /><br />Reeve/Hackman/Kidder were acting so easy, with fun. What a difference.<br /><br />The Jesus poses at the end are ridiculous too. What the hell should that be ? The problem here is, they mean this serious, not as a joke. Next time Spiderman or Batman or Ironman falls and rises like Jesus or angels ? Or they speak with god directly. Why not ? They are superheroes, saving human lives every day. So at least one talk with god every week should be possible... Oh my god.<br /><br />Maybe this was not the real announced movie, instead it is from a bizarre dull parallel universe.<br /><br />For the warner brothers this superlame depressive flick will be possibly the greatest disaster in history. Not only because of the money.<br /><br />I understand how difficult it (maybe) was to create and transport some messages or feelings, but showing lone, lost and sadly people isn't new and thousands of movies or TV-Shows did it better, in very old or new ones like magnolia. And the flying frogs there were more impressive than this flying superwoman, sorry, superman of course.<br /><br />Singer and WB, that's simply nothing. In fact it's even more than nothing, it's like a black hole that destroys the passion for (comic/superhero) movies and steals us three hours of our life.<br /><br />Mrs. Smilla's little brother. (Very angry and green like the hulk.)",0
"This movie lacks in everything. Except Bobby deol, who in his own standards is mediocre, no one in this movie has come close to act in a single scene. Kangana is complete fake in her acting.<br /><br />The great Anupam Kher has a guest appearance and is better in those 2 minutes than bobby in the whole movie. The music does'nt compliment the movie<br /><br />that well. The contrast in Music between Bobby and Upen is not highlighted that well. Great concept gone completely wrong. The movie does'nt have a proper ending. Please don't waste your time as i did on this movie",0
"Why did I have to go out and buy (yes buy!) JACK FROST 2: REVENGE OF THE MUTANT KILLER SNOWMAN??? Maybe it was a burst of temporary mental derangement? But I'm guessing it's because I kind of enjoyed the first JACK FROST. It was a silly but funny horror-comedy which had some okay effects by Screaming Mad George. That and the fact that on the back-cover of the sequel there was this nice picture of this guy impaled by this giant icicle (coming out of his mouth with a lot of blood and all). So I thought: if it's as idiotic as the first and has some nice splatter/gore in it, it should be fun, right? Well, I was so dead wrong! <br /><br />Let me first say that the movie deserves some credit for having an immensely insane and retarded plot. I mean, a mutant killer snowman on a tropical island that spawns mutant killer baby snowballs which can only be killed or harmed by bananas??? As much as I love the premise, I really hated the movie. First of all: while the first JACK FROST looked like an actual movie (seemingly being shot on real film and all), this sequel has the look and feel of a third-rate soap-opera. It has this way too slick shot-on-video look. The lighting is just plain awful (bright white spots for the day look, and stupid colors like blue and green at night). The acting... well don't even go there. The dialogues range from stiff to extremely senile (that Jamaican man was just moronic, saying ""man"" after every sentence). And when it comes to the voice of the killer snowman, all I could think of was a seventh-rate Chucky from CHILD'S PLAY spewing dumb and supposedly witty one-liners before he kills someone.<br /><br />The best joke was were one guy asks ""Why are you talking to your watch?"". And the best scene was undoubtedly the one with that beautiful Asian chick popping up out of nowhere and taking a swim in the pool totally naked (thank god for that!). Oh, yeah, and that little scene over the end-credits with those two Japanese dudes on a miniature ship being badly dubbed had me laughing too. But the worst thing about this movie was: Where was the gore and splatter action everyone is talking about? There were plenty of occasions to show some decent gory killings. A lot of people were killed off in original ways here, but all off-screen. Like I've read in many other comments, there were indeed nice set-ups to a head explosion, a crushed body, eyes being poked out, tongue ripped out,... but on the crucial moments the editor cuts away to some blood splatters on the floor or nothing at all. That frontal shot of that British guy being impaled (from the back-cover of the DVD) wasn't even in the movie. I only saw that particular killing filmed from the back (meaning I didn't see sh!t!). I was waiting throughout the whole movie for that to happen, and then I get to see nothing?!?! What a let-down! Could it be that I saw a cut version of the movie? That would be a shame, 'cause only a decent amount of splatter-fun could have saved this movie if you ask me. Seeing a lot of killer snowballs reduced to bloody pulp just didn't cut it for me. Speaking of those snowballs: they were done very poorly. They made MUNCHIES look like state-of-the-art 'animatronics'. But I guess that was the whole point of it. At some point, the special effects crew even turned to some laughably bad CGI. Boy, you really have to see it to believe it. Best is to not see it, actually, 'cause this flick is just too bad (okay, I did laugh with it, for it kept getting worse and worse). Just stick with the first JACK FROST (1996) and you'll be okay (just bare in mind that it's a pretty silly horror-comedy but fun in it's own right).<br /><br />It's funny, but writer/director Michael Cooney somehow must have realized that he was a pretty bad director after JACK FROST 2, and then focused on writing. Turns out he then wrote two pretty good thriller screenplays for THE I INSIDE (starring Ryan Phillippe) and IDENTITY (starring John Cusack). So the man seems to have some talent after all.<br /><br />Now it would be far too easy to give JACK FROST 2 the lowest rating possible. So I say one point for that naked Asian babe doing the skinny dipping and one point for those completely retarded snowball babies. Way to go Mr. Cooney!",0
