review,sentiment
"I don't see why all the people are giving this film negative reviews?!?! I loved this movie! Bled is a form of abstract art, and if you don't appreciate art, I can see why you would not like this film. It was a great twist from the average, played out vampire movie. If you are looking for a fresh, new and ingenious new vampire movie, then this is for you. But if you want one of those turn into bats, wolves and melt in the sunlight movies, then go watch your old played out Dracula flicks. Sure, it is a bit on the low budget side, but they did a great job with the budget they had. I'm very happy that I found this movie, because I was about to give up on the vampire genre fro good. I thought this film was brilliant! I give 2 thumbs up to the writer, director and everyone involved in the film.",1
"Okay, I absolutely LOVE Ben Stiller, although I am lukewarm about Jennifer Aniston. I do not think this girl can act in the least. Every movie or sitcom I've seen her in is very hard to get past her fake acting. It sounds like she is just standing there reading right off the script. This movie only had one good thing about it, and that's that Ben Stiller was in it. This plot is so used and abused it's ridiculous. How many movies have this same type of plot?? Can we say ""Forces of Nature??"" Not only is the plot so old, but the outcome is so predictable, it's boring. I knew everything that was going to happen before it did. It was a bore, but watching Stiller is always a delight!!!",0
"The film disappointed me for many reasons: first of all the depiction of a future which seemed at first realistic to me was well-built but did only feature a marginal role. Then, the story itself was a weak copy of Lost in Translation. The Middle-Eastern setting, man with family meets new girl overseas, karaoke bar, the camera movements and the imagery - all that was a very bad imitation of the excellent Lost in Translation which had also credibility. This movie tries to be something brilliant and cultural: it is not. I wonder why Tim Robbins even considered doing this film!? The female main actress is awful - did she play the precog in Minority Report? And why do you have to show the vagina in a movie like this? Lost in Translation didn't have to show excessive love scenes. R-Rated just for this? This movie isn't even worth watching it from a videostore!",0
"Just about everything in this movie is wrong, wrong, wrong. Take Mike Myers, for example. He's reached the point where you realize that his shtick hasn't changed since his SNL days, over ten years ago. He's doing the same cutesy stream-of-consciousness jokes and the same voices. His Cat is painfully unfunny. He tries way to hard. He's some weird Type A comedian, not the cool cat he's supposed to be. The rest of the movie is just as bad. The sets are unbelievably ugly --- and clearly a waste of millions of dollars. (Cardboard cut-outs for the background buildings would have made more sense than constructing an entire neighborhood and main street.) Alec Balwin tries to do a funny Great Santini impression, but he ends up looking and sounding incoherent. There's even an innapropriate cheesecake moment with faux celebrity Paris Hilton --- that sticks in the mind simply because this is supposed to be a Dr. Seuss story. Avoid this movie at all costs, folks. It's not even an interesting train wreck. (I hope they'll make Horton Hears a Who with Robin Williams. Then we'll have the bad-Seuss movie-starring-spasitc- comedian trilogy.)",0
"I just got done watching The Edge of Love (by the way, this is one of the worst titles so far this year) and it felt like a chore. Watching Keira Knightly's unlikable, skeleton-looking character made me cringe even more throughout the coarse of the film.<br /><br />It took me four nights to watch this it was so boring. The only good thing about it was Cillian Murphy. He's always good/believable and is severely under looked in many films. This, however, was just not good enough for him.<br /><br />Apart from the unlikable characters, boring storyline, the plot was also emotionally unsatisfying. I felt like I spent my time watching this for nothing (which I did). I should have done the smart thing and turned it off, but I kept it on out of respect for Cillian Murphy and the great cinematography.",0
"Why bother to see this movie? It probably rates an award for being the worst career move of a major movie star since Clark Gable's laughable playing of an Irish patriot in Parnell.<br /><br />It's inconceivable that Bergman would choose both this movie and its director over a lucrative Hollywood career where she could choose among the finest scripts and directors being offered at that time. To begin with, there was no script to work with except a few notes. Then we are supposed to believe the polished Bergman as a poor refugee willing to do anything to be released from a refugee camp, including marriage to a poor Italian fisherman she doesn't even love. I read where Anna Magnani was the original choice for this part. If so, that made a lot more sense than to cast the luminous Bergman in such a proletarian part. But since she was in love with her director, common sense flew out the window.<br /><br />So she goes to live in this poor village where the men must toil to extract a meager living from the sea. A place she obviously hates to be and where she doesn't fit in.<br /><br />Her only friend is the village priest who knows she's not suited to the life of a poor fisherman's bride, but tells her that for the sake of love she must repress her true feelings of revulsion, and accept the poverty and despair she encounters each day. On top of all of this, there's this volcano always on the brink of erupting and drowning them all in hot lava. But like a true heroine, Bergman revolts against her misery by declaring war on just about everyone else in this dreary film. She even goes as far as trying to seduce the village priest, in a scene that would generate laughter if it were not so pathetic. Since her poor slob of a husband must lock her in a room to keep her from running away, she's forced to use her body to bribe a married man to take her off the island. To her, no sacrifice is too great; no man unapproachable if he is willing to help her to escape the island and her misery. I won't bother to tell you how this all ends. The no-script movie ending is as plausible as the rest of STROMBOLI. I even remember (from seeing it on late night TV) that it had two different endings! So be warned if you should feel brave enough to sit through this king-size turkey and catch the miscast Bergman. It led to her downfall in Hollywood for the next seven years and she was condemned for sleeping with her director while still married to Peter Lindstrom. None of the movies she made with this director(whom she later married) are noteworthy except as proof of a career gone berserk. I kid you not. It's pretty embarrassing.<br /><br />- - SoundTrack",0
"When you think of brilliant Australian comedy you don't think of Skit shows (Although I'm quite partial to a bit of 80's and 90's Full Frontal) or even Sitcoms - you think of SATIRE! Something that we Australians really know how to do well. (Eg: Front Line, The Micallef Program) We know how to take the pi$$, and The Chaser's War on Everything, is a classic example of how to do it, and how to do it really well. <br /><br />I've been a huge fan of Chris Taylor and Craig Reucassel for a long time. I remember listening to them on Triple J's afternoon show. They were, and remain, two of the funniest comedians around.<br /><br />Although I was sad when they left Triple J, I was excited to find out what they were investing so much time in that made them have to leave. (They were doing CNNNN and Triple J at the same time, so I figured this was something much bigger) And what an amazingly HILARIOUS show Chaser is. Biting political and social satire at it's best.<br /><br />I'm also pleased to say that it has recently received a MUCH better time slot than Friday nights and has been moved to Wednesday nights right after Spicks and Specks. THANK YOU ABC!! Finally I don't have to tape it! :)",1
"""In Love and War"" is a simple feel-good TV-film, and should be viewed as such.<br /><br />(Possible spoiler)<br /><br />It is the story of a WWII British soldier, Newby, captured with his commando by the Italians and imprisoned in a former orphanage. As the Italians surrender to the Allies, the commando is freed, and attempts to flee. However, the Germans arrive and the commando is captured again. Only Newby, injured, remains at large. The rest of the film recounts how he is hidden and protected by the Partisans, and his survival.<br /><br />(End of spoiler)<br /><br />Based on a true story, ""In Love and War"" is a refreshingly straightforward film. Half comedy, half romance, the story is simple and unambiguous. The 'atmosfera' is warm and sunny, and the various stereotypes (the desperately unorganized or romantic Italians, the serious stern-looking Germans and the phlegmatic and pragmatic British), although unoriginal, are still humorous. Nicola Piovani's musical score also adds to the Mediterranean flavour.<br /><br />Although it is far from being a ""Tea With Mussolini"" or a ""La Vita E Bella"", ""In Love and War"" is a sweet simple film that will put a smile, and maybe even a little tan, on your face.",1
"A cheesy ""B"" crime thriller of the early '50, the story is droll, the characters wooden, Allison Hayes and Abbe Lane are the only two sexpots that make it an eye-catcher, but one short shot, only a few frames long, shows an ""el"" train crossing the river on the State Street bridge, of the 6000 series Pullman-built cars painted in their original 1950 paint scheme, as they were delivered when new in 1950. For traction fans like me, that one short take makes the picture worthwhile. I think films like this one, Ulmer's DETOUR, D.O.A. with Edmund O'Brien,THE FUGITIVE with Harrison Ford, and others of the film noir genre, (big city crime dramas) make it interesting if for nothing other than the fact that I know Chicago and San Francisco intimately and recognize most of the street locations. Other wise it's a really droll boring film!",0
"A labor of love. Each frame is picture perfect and grabs you. Then the sheer emotion and story-telling take you through a dream that stays with you long after the movie. The director gets your heart and leads it through 100 minutes of visual poetry. You are a part of the emotional ride of the characters. I have seen this movie at 2 festivals and it got with standing ovations at every showing. The remarkable story-telling transcends nationality and language and I felt I was a part of the drama unfolding before me. The casting is as perfect as one can get. Vijay Raaz, Camille and Benoit each hold their own. <br /><br />I strongly recommend this film to everyone who appreciates good cinema. I can't wait for the commercial release of this movie.",1
"I saw this back in '94 when it was finally released. Apparently because Orion pictures was in bankruptcy, I think, the movie had not been released a couple of years earlier.<br /><br />I have problem remembering details partly because I haven't seen it in a long time, but I do remember it as a very dull movie. I kept debating whether to walk out of it. The store was not at all interesting or engaging. Was a 3rd rate America Graffiti imitation. <br /><br />None of the performances make it worth watching either. One of the biggest disappointments since a local newspaper reviewer gave it a high rating.",0
I saw this on a boring Sunday morning just this morning. Well I was drawn to the fact that it's an outdoor movie.. I was hoping to find some nice sceneries but it the views where just limited.. They just go back and forth in the same spot all over again.. I hate it when they're using this so called hi-tech stuffs like the this Motorola blue-tooth headset they're using to eliminate the use of a walkie talkie it was just so funny.. they look like amateurs. And they where like advertising those badly designed alien-ware Laptops that could link up to a satellite to find people.. I couldn't say more about this TV-movie.. The ending was bad that it looks like they cut it short eliminating the use of rescue helicopters and etc.. */**********,0
"Rosenstrasse is more an intimate film than one of epic proportions, which could have kept away many film goers looking for a Pianist similar plot. Fortunately, Von Trotta, a good screenwriter, opts for a feminist peep to an era too much illustrated on its colorful exterior, but too little analyzed in terms of intimacy and from the point of view of ordinary Aryan German rather from a Jewish standpoint. Rosentrasse finds its strength in these unsung burdens of people trapped within historical circumstances of which they emerge as victims. The pace of the film is introspective, poignantly slow, meditative. Besides, the characters are so vivid while transitions between generations and the passing of time has been deftly crafted. Rosenstrasse is not a masterpiece, and some narrative flaws are well discerned. Another fault lies on a trivial cinematography unable to capture the intensity of the internal drama lived by the characters. Nevertheless, this film is worth seeing. Finally, Rosenstrasse is part of the last trend in German films dealing with the ghosts of a nightmarish past,trend that includes such excellent films as Nowhere in Africa, and recently, the controversial Downfall. I would recommend this film to those who know how to read beyond the images.",1
"I saw this film on True Movies (which automatically made me sceptical) but actually - it was good. Why? Not because of the amazing plot twists or breathtaking dialogue (of which there is little) but because actually, despite what people say I thought the film was accurate in it's depiction of teenagers dealing with pregnancy.<br /><br />It's NOT Dawson's Creek, they're not graceful, cool witty characters who breeze through sexuality with effortless knowledge. They're kids and they act like kids would. <br /><br />They're blunt, awkward and annoyingly confused about everything. Yes, this could be by accident and they could just be bad actors but I don't think so. Dermot Mulroney gives (when not trying to be cool) a very believable performance and I loved him for it. Patricia Arquette IS whiny and annoying, but she was pregnant and a teenagers? The combination of the two isn't exactly lavender on your pillow. The plot was VERY predictable and but so what? I believed them, his stress and inability to cope - her brave, yet slightly misguided attempts to bring them closer together. I think the characters, acted by anyone else, WOULD indeed have been annoying and unbelievable but they weren't. It reflects the surreality of the situation they're in, that he's sitting in class and she walks on campus with the baby. I felt angry at her for that, I felt angry at him for being such a child and for blaming her. I felt it all.<br /><br />In the end, I loved it and would recommend it.<br /><br />Watch out for the scene where Dermot Mulroney runs from the disastrous counselling session - career performance.",1
"Like in a circle the movie leads back to its point of departure, the image of the cranes that are crossing a Muscovite sky. They represent the freedom to realize your life as you wish, in order to aspire the greatest possible fulfilment.<br /><br />In the beginning Veronica and Boris experience such a promise of happiness, and their eyes follow the path of the cranes in exhilaration. It seems as if they might be able to live according to their dreams.<br /><br />But Man is not a bird. Life draws up its own rules, from which no human can escape and which we cannot change - not even by making a supreme effort. War breaks out, and without much hesitation Boris signs up for the front in order to fulfil his patriotic duty. He cannot even say good-bye to Veronica, for she arrives late at the assembly point from which the soldiers are sent away. Surrounded by a jubilant crowd all her attempts to attract Boris' attention must inevitably fail.<br /><br />Boris eventually gets killed in war, without Veronica learning about it for the moment. His brother Mark, a vigorous musician, who obtained the exemption from military service by corruption, is eager to take his place. Veronica initially resists, but in a frightful night of bombing she finally falls victim to his charms. A marriage takes place, which is never accepted by the family.<br /><br />Soon feelings of guilt seize hold of Veronica and she realizes that Boris' return is the one and only thing she actually longs for. She therefore eases her bad conscience and despair by the self-sacrificing work in a field hospital.<br /><br />When war finally is over, once again a crowd of enthusiastic people gathers in order to cheer the victorious soldiers. Again Veronica is among them, forcing her way through a wall of bodies. In her hand she is carrying a bunch of flowers, until she finally has to give it away to complete strangers, for one of the homecomers has just dashed her hopes by confirming the sad certainty of Boris' death.<br /><br />Once again the cranes invade the sky, drawing their wayward lines. But now Veronica is watching them on her own, and the look in her eyes is a different one. She has had to accept the impossibility to live according to preconceived plans, to follow the guidelines of your dreams. For all humans are nothing but helpless puppets hanging on the inscrutable strings of fate.<br /><br />",1
"OK. Who brought the cheese. I love it. During it's run it became a phenomenon. The Anorexic Twins became popular.Bob Saget started making a paycheck (Instead of his REALLY funny stand-up). And people knew who Dave Coulier was. This is when life was good and simple. This is one of the great American classics. It was humorous and always brought home a good lesson. And this is where I differ from the norm: I liked the last few seasons. Like Home Improvement, when children get older there are a lot more you can do with the script. This is why I dare say...It could have gone much later than it did. But anyway. I gave it an 8/10 because of its wholesome, funny story lines, and because of Bob Saget!",1
"not a Larry Mcmurty masterpiece but it stands on its own as a good western, any of the lonesome doves do. who ever takes on the role of Woodrow call, does a great portrayal in their own style. It's also easy to see that they were looking to use this as a stepping stone to the t.V series (both version of it) and that the writers knew how to keep the flavor alive William Peterson was awesome in this, the geeky C.S.I guy is not the character he plays in this - this guy can do it all it seems<br /><br />it's deserve to be enjoyed by those who enjoy westerns<br /><br />4out5 stars",1
"George Barry's ""Death Bed: The Bed That Eats"" is, at root, a dark fairy tale told via a horror-movie framework. It is, in my opinion, one of the best films of the 1970s, and it's downright criminal that the picture was basically stolen and distributed without Barry's knowledge (those responsible for this theft should be fed to the bed, ASAP). If you're looking for overt gore or rabid action, ""Death Bed: The Bed That Eats"" isn't the flick for you. ""Death Bed"" is a gentler, weirder drive-in picture; it plays like an utterly strange dream, half-remembered. I'd recommend reading Stephen Thrower's summation of ""Death Bed"" in Thrower's FAB Press book, ""Nightmare USA"" (he describes the movie's vibe perfectly). Whether intentional or not, I've noticed shades of ""Death Bed"" in everything from the ""Phantasm"" films to Michele Soavi's ""Cemetery Man"" to the magic-realism/slipstream fiction of authors such as Kelly Link. Barry is an original and in a fair world I'm sure he would've followed ""Death Bed"" with a number of fantastically bizarre films.",1
"Licence fees to watch this trash, And pay for it with hard-earned cash? Humourless, no hint of laughter, God knows how it won a BAFTA! <br /><br />We've now been subjected to ""Eastenders"" for twenty years. When, oh when is the Great British public going to see this awful soap for what it is? Crass Pap! This programme no more depicts reality in the East End of London than everyday life in Beirut, and never has done.<br /><br />The Eastenders I know (the real ones) are kind, courageous, hardworking and loyal. And one of their greatest attributes is humour. It was the Eastenders who went through the worst of the London blitz and still stuck two fingers up to Hitler. And what do we see on our screens for five days of the week (including an omnibus)? Nothing but a bunch of moaning, wailing, ""dead from the neck up"" wimps, who seem to do little else than sit in a pub all day sniping at each other. What a great advert for Britain that is!! Do the writers actually believe this garbage they're pumping out? Obviously the woolly-minded section of the public does, but then I've heard that apparently anyone can be brainwashed into believing anything.",0
"Tyra Banks needs to teach these girls that it's not all about being beautiful on the outside. The inside counts for something too. A lot of the past winners have looked semi decent but are horribly cruel and starting trouble for the other girls. I see Tyra less involved with the girls in every season. About the only thing worth watching Top Model for is Mr. Jay Manuel. Recently, Tyra had a contestant who was a pre-op transsexual. I felt that she should have done more to encourage her. It was obvious that she had insecurities about her original anatomy showing through her feminine look. Tyra should have given her tips or perhaps she could have sent resident Trannie Ms. Jay to help the girl out. Instead, the contestant was met with harsh criticism and not enough positive criticism. It's a shame because I truly enjoyed the first 3 seasons. There's a reason why Project Runway has all 4 seasons out on DVD and Top Model only has 1 season on DVD. It's called taste. Top Model seriously needs a lot of revamping an some more humanity.",0
"OK - you want to test somebody on how comfortable they are with their adolescence and the embarrassing and maniacal changes therin - then get their immediate reaction from watching this uproarious doc about kids making socially relevant horror flicks in the suburban 80's. More than any movie I has ever seen, the film deals with burdening sexuality and ego in a way that is completely human, never dull, and flushed in the kind of inherent goodness of youth that is discolored by the fear-frenzied adult world where any quirk in youth is accredited to anything from insanity to perversion. Mini-mogul Darren Stien seems to be reaching for a deeper understanding of his triumphs and misgivings as the patriarch of strict kid's world. What he finds in himself and others isn't always pretty - but shows how one can improve and reconcile with age. What does change mean without reflection. I love this movie.",1
"Well made documentary focusing on two Sudanese refugees who get resettled in the United States. It's your basic fish out of water story with a non-fiction twist. I found it fascinating to see how Peter and Santino lived prior to coming to America and how they adapted once they arrived here (in Houston, Texas.) They expected a sort of heaven but found out that it's a lot harder than it looks to cope well in the states. They go from hopeful idealists to somewhat more realistic skeptics. Everywhere they go they meet bureaucrats with paper trails that most citizens may take for granted. They fret that they are blacker than the African-Americans here and don't feel accepted because of that. One of the ""Lost Boys"" manages to leave Houston to go to Olathe, Kansas, where he finds conditions slightly better but still less than ideal. There are people that try to help them as well as try to hurt them in this film. Not shown, but talked about, are those who put a gun to their heads and robbed them, leading one Lost Boy to comment negatively that ""all black people in America are no good."" I found it interesting, too, that they arrived in Houston in August 2001, a month before the World Trade Center was attacked by terrorists. I had hoped to see their reaction to this tragedy but it's not mentioned at all. Still, all in all, a really well done documentary with no narration. None is needed really. The ""Lost Boys"" do a fine job expounding on the events going on around them without any help at all, thank you very much.",1
